msc {

  "210.146.64.4", "81.131.67.131", "38.115.4.204", "70.27.127.185", "213.19.160.190", "200.158.81.150", "24.43.167.12", "81.247.65.177", "24.102.197.177", "83.117.6.35", "195.130.143.128", "212.194.202.220", "207.148.176.7", "62.193.101.150", "212.129.214.254", "172.177.184.179", "172.186.173.245", "207.216.13.37", "82.44.146.72", "142.68.189.57", "68.186.167.166", "68.34.169.230", "85.96.110.115", "83.112.25.172", "24.11.146.28", "68.45.204.224", "213.120.62.99", "82.10.189.102", "62.203.155.212", "83.132.177.64", "2002:5183:4383::5183:4383", "2001:638:902:1:201:2ff:fee2:7596", "84.56.231.176", "62.205.109.173", "80.171.9.79", "62.131.99.79", "147.10.31.210", "211.28.6.30", "83.53.165.235", "84.149.148.25", "81.161.144.10", "195.14.223.213", "202.133.203.254", "62.34.123.244", "218.72.89.80", "213.189.168.206", "80.144.139.239", "81.244.90.24", "219.137.42.1", "139.168.32.121", "213.54.85.41", "82.192.36.209", "82.216.238.111", "69.227.71.60", "139.55.21.35", "213.224.41.203", "69.4.150.232", "65.43.223.20", "151.37.67.40", "80.125.99.71", "82.92.21.6", "84.156.173.210", "82.92.79.199", "68.21.34.173", "81.241.94.212", "82.171.96.179", "84.97.114.126", "80.185.105.19", "83.117.2.56", "82.232.4.28", "62.167.89.152", "85.135.146.10", "83.116.155.57", "84.101.247.219", "218.86.72.220", "80.186.123.15", "60.224.255.117", "68.6.198.57", "172.187.62.41", "65.184.193.172", "67.111.163.61", "62.74.99.96", "84.84.15.199", "149.156.74.157", "209.89.41.78", "172.201.93.149", "86.130.246.222", "69.224.47.236";
  "210.146.64.4"=>"81.131.67.131" [label="(TCP)  80 -> 2727 [ACK] Seq=1 Ack=1 Win=6432 Len=1460"];
  "81.131.67.131"=>"210.146.64.4" [label="(TCP)  2727 -> 80 [ACK] Seq=1 Ack=1461 Win=8760 Len=0"];
  "81.131.67.131"=>"38.115.4.204" [label="(TCP)  2667 -> 21284 [PSH, ACK] Seq=1 Ack=1 Win=7482 Len=56"];
  "81.131.67.131"=>"70.27.127.185" [label="(TCP)  2094 -> 6346 [ACK] Seq=1 Ack=40 Win=7886 Len=0"];
  "210.146.64.4"=>"81.131.67.131" [label="(TCP)  80 -> 2727 [ACK] Seq=1461 Ack=1 Win=6432 Len=1460"];
  "213.19.160.190"=>"81.131.67.131" [label="(TCP)  80 -> 2810 [SYN, ACK] Seq=0 Ack=1 Win=5840 Len=0 MSS=1460 SACK_PERM=1"];
  "81.131.67.131"=>"213.19.160.190" [label="(TCP)  2810 -> 80 [ACK] Seq=1 Ack=1 Win=8760 Len=0"];
  "81.131.67.131"=>"210.146.64.4" [label="(TCP)  2727 -> 80 [ACK] Seq=1 Ack=2921 Win=8760 Len=0"];
  "81.131.67.131"=>"213.19.160.190" [label="(HTTP)  GET /msdownload/update/v5/psf/windowsxp-sp2-x86fre-usa-2180_056b2b38baf5620be85ddd58141b073bc0b06a1d.psf HTTP/1.1"];
  "38.115.4.204"=>"81.131.67.131" [label="(TCP)  21284 -> 2667 [PSH, ACK] Seq=1 Ack=1 Win=65535 Len=338"];
  "81.131.67.131"=>"38.115.4.204" [label="(TCP)  2667 -> 21284 [ACK] Seq=57 Ack=339 Win=8760 Len=0"];
  "210.146.64.4"=>"81.131.67.131" [label="(TCP)  80 -> 2727 [PSH, ACK] Seq=2921 Ack=1 Win=6432 Len=1460"];
  "81.131.67.131"=>"210.146.64.4" [label="(TCP)  2727 -> 80 [ACK] Seq=1 Ack=4381 Win=8760 Len=0"];
  "200.158.81.150"=>"81.131.67.131" [label="(ICMP)  Destination unreachable (Port unreachable)"];
  "81.131.67.131"=>"24.43.167.12" [label="(UDP)  41730 -> 6346 Len=19"];
  "81.131.67.131"=>"81.247.65.177" [label="(UDP)  41730 -> 6346 Len=19"];
  "24.102.197.177"=>"81.131.67.131" [label="(UDP)  4917 -> 41730 Len=8"];
  "81.131.67.131"=>"83.117.6.35" [label="(UDP)  41730 -> 6346 Len=19"];
  "81.131.67.131"=>"195.130.143.128" [label="(UDP)  41730 -> 6346 Len=19"];
  "81.131.67.131"=>"212.194.202.220" [label="(UDP)  41730 -> 6346 Len=19"];
  "81.131.67.131"=>"207.148.176.7" [label="(UDP)  41730 -> 6346 Len=19"];
  "81.131.67.131"=>"62.193.101.150" [label="(UDP)  41730 -> 6346 Len=19"];
  "81.131.67.131"=>"212.129.214.254" [label="(UDP)  41730 -> 6346 Len=19"];
  "81.131.67.131"=>"172.177.184.179" [label="(UDP)  41730 -> 6346 Len=19"];
  "81.131.67.131"=>"172.186.173.245" [label="(UDP)  41730 -> 6346 Len=19"];
  "81.131.67.131"=>"207.216.13.37" [label="(UDP)  41730 -> 6346 Len=19"];
  "81.131.67.131"=>"82.44.146.72" [label="(UDP)  41730 -> 34087 Len=19"];
  "81.131.67.131"=>"142.68.189.57" [label="(TCP)  1595 -> 6346 [ACK] Seq=1 Ack=37 Win=8830 Len=0"];
  "210.146.64.4"=>"81.131.67.131" [label="(TCP)  80 -> 2727 [ACK] Seq=4381 Ack=1 Win=6432 Len=1460"];
  "68.186.167.166"=>"81.131.67.131" [label="(UDP)  13778 -> 41730 Len=8"];
  "81.131.67.131"=>"210.146.64.4" [label="(TCP)  2727 -> 80 [ACK] Seq=1 Ack=5841 Win=8760 Len=0"];
  "210.146.64.4"=>"81.131.67.131" [label="(TCP)  80 -> 2727 [ACK] Seq=5841 Ack=1 Win=6432 Len=1460"];
  "68.34.169.230"=>"81.131.67.131" [label="(TCP)  6346 -> 2433 [PSH, ACK] Seq=1 Ack=1 Win=64332 Len=28 [TCP segment of a reassembled PDU]"];
  "81.131.67.131"=>"210.146.64.4" [label="(TCP)  2727 -> 80 [ACK] Seq=1 Ack=7301 Win=8760 Len=0"];
  "81.131.67.131"=>"68.34.169.230" [label="(TCP)  2433 -> 6346 [ACK] Seq=1 Ack=29 Win=8016 Len=0"];
  "210.146.64.4"=>"81.131.67.131" [label="(TCP)  80 -> 2727 [ACK] Seq=7301 Ack=1 Win=6432 Len=1460"];
  "81.131.67.131"=>"210.146.64.4" [label="(TCP)  2727 -> 80 [ACK] Seq=1 Ack=8761 Win=8760 Len=0"];
  "81.131.67.131"=>"85.96.110.115" [label="(UDP)  41730 -> 6346 Len=19"];
  "210.146.64.4"=>"81.131.67.131" [label="(TCP)  80 -> 2727 [ACK] Seq=8761 Ack=1 Win=6432 Len=1460"];
  "81.131.67.131"=>"83.112.25.172" [label="(UDP)  41730 -> 6346 Len=19"];
  "81.131.67.131"=>"24.11.146.28" [label="(UDP)  41730 -> 17342 Len=12"];
  "38.115.4.204"=>"81.131.67.131" [label="(TCP)  21284 -> 2667 [ACK] Seq=339 Ack=57 Win=65479 Len=0"];
  "81.131.67.131"=>"68.186.167.166" [label="(UDP)  41730 -> 13778 Len=508"];
  "213.19.160.190"=>"81.131.67.131" [label="(TCP)  80 -> 2810 [ACK] Seq=1 Ack=301 Win=6432 Len=0"];
  "81.131.67.131"=>"210.146.64.4" [label="(TCP)  2727 -> 80 [ACK] Seq=1 Ack=10221 Win=8760 Len=0"];
  "81.131.67.131"=>"38.115.4.204" [label="(TCP)  2667 -> 21284 [PSH, ACK] Seq=57 Ack=339 Win=8760 Len=8"];
  "81.131.67.131"=>"68.45.204.224" [label="(UDP)  6348 -> 6346 Len=33"];
  "213.19.160.190"=>"81.131.67.131" [label="(HTTP)  HTTP/1.1 206 Partial Content"];
  "81.131.67.131"=>"213.19.160.190" [label="(TCP)  2810 -> 80 [ACK] Seq=301 Ack=300 Win=8461 Len=0"];
  "81.131.67.131"=>"70.27.127.185" [label="(TCP)  2094 -> 6346 [ACK] Seq=1 Ack=75 Win=7851 Len=0"];
  "210.146.64.4"=>"81.131.67.131" [label="(TCP)  80 -> 2727 [ACK] Seq=10221 Ack=1 Win=6432 Len=1460"];
  "81.131.67.131"=>"210.146.64.4" [label="(TCP)  2727 -> 80 [ACK] Seq=1 Ack=11681 Win=8760 Len=0"];
  "213.19.160.190"=>"81.131.67.131" [label="(HTTP)  ContinuationContinuation"];
  "81.131.67.131"=>"213.19.160.190" [label="(TCP)  2810 -> 80 [ACK] Seq=301 Ack=616 Win=8145 Len=0"];
  "210.146.64.4"=>"81.131.67.131" [label="(TCP)  80 -> 2727 [PSH, ACK] Seq=11681 Ack=1 Win=6432 Len=1460"];
  "81.131.67.131"=>"210.146.64.4" [label="(TCP)  2727 -> 80 [ACK] Seq=1 Ack=13141 Win=8760 Len=0"];
  "81.131.67.131"=>"142.68.189.57" [label="(TCP)  1595 -> 6346 [ACK] Seq=1 Ack=70 Win=8797 Len=0"];
  "81.131.67.131"=>"213.120.62.99" [label="(DNS)  Standard query 0x006a AAAA ftp.ipv6.uni-leipzig.de"];
  "81.131.67.131"=>"82.10.189.102" [label="(UDP)  41730 -> 6346 Len=19"];
  "210.146.64.4"=>"81.131.67.131" [label="(TCP)  80 -> 2727 [ACK] Seq=13141 Ack=1 Win=6432 Len=1460"];
  "81.131.67.131"=>"62.203.155.212" [label="(UDP)  41730 -> 6346 Len=19"];
  "81.131.67.131"=>"83.132.177.64" [label="(UDP)  41730 -> 6346 Len=19"];
  "68.34.169.230"=>"81.131.67.131" [label="(TCP)  6346 -> 2433 [PSH, ACK] Seq=29 Ack=1 Win=64332 Len=24 [TCP segment of a reassembled PDU]"];
  "81.131.67.131"=>"68.186.167.166" [label="(UDP)  41730 -> 13778 Len=508"];
  "81.131.67.131"=>"210.146.64.4" [label="(TCP)  2727 -> 80 [ACK] Seq=1 Ack=14601 Win=8760 Len=0"];
  "81.131.67.131"=>"68.34.169.230" [label="(TCP)  2433 -> 6346 [ACK] Seq=1 Ack=53 Win=7992 Len=0"];
  "210.146.64.4"=>"81.131.67.131" [label="(TCP)  80 -> 2727 [ACK] Seq=14601 Ack=1 Win=6432 Len=1460"];
  "81.131.67.131"=>"210.146.64.4" [label="(TCP)  2727 -> 80 [ACK] Seq=1 Ack=16061 Win=8760 Len=0"];
  "210.146.64.4"=>"81.131.67.131" [label="(TCP)  80 -> 2727 [ACK] Seq=16061 Ack=1 Win=6432 Len=1460"];
  "81.131.67.131"=>"210.146.64.4" [label="(TCP)  2727 -> 80 [ACK] Seq=1 Ack=17521 Win=8760 Len=0"];
  "81.131.67.131"=>"213.120.62.99" [label="(DNS)  Standard query 0x006a AAAA ftp.ipv6.uni-leipzig.de"];
  "213.19.160.190"=>"81.131.67.131" [label="(HTTP)  Continuation"];
  "81.131.67.131"=>"213.19.160.190" [label="(TCP)  2810 -> 80 [ACK] Seq=301 Ack=2076 Win=8760 Len=0"];
  "81.131.67.131"=>"68.186.167.166" [label="(UDP)  41730 -> 13778 Len=508"];
  "213.19.160.190"=>"81.131.67.131" [label="(HTTP)  Continuation"];
  "68.45.204.224"=>"81.131.67.131" [label="(UDP)  6346 -> 6348 Len=32"];
  "81.131.67.131"=>"213.19.160.190" [label="(TCP)  2810 -> 80 [ACK] Seq=301 Ack=3536 Win=8760 Len=0"];
  "81.131.67.131"=>"68.45.204.224" [label="(UDP)  6348 -> 6346 Len=373"];
  "38.115.4.204"=>"81.131.67.131" [label="(TCP)  [TCP Retransmission] 21284 -> 2667 [PSH, ACK] Seq=1 Ack=57 Win=65479 Len=1007"];
  "81.131.67.131"=>"38.115.4.204" [label="(TCP)  [TCP ACKed unseen segment] 2667 -> 21284 [ACK] Seq=65 Ack=1008 Win=8091 Len=0"];
  "210.146.64.4"=>"81.131.67.131" [label="(TCP)  80 -> 2727 [PSH, ACK] Seq=17521 Ack=1 Win=6432 Len=1460"];
  "81.131.67.131"=>"210.146.64.4" [label="(TCP)  2727 -> 80 [ACK] Seq=1 Ack=18981 Win=8760 Len=0"];
  "38.115.4.204"=>"81.131.67.131" [label="(TCP)  21284 -> 2667 [ACK] Seq=1008 Ack=65 Win=65471 Len=0"];
  "81.131.67.131"=>"38.115.4.204" [label="(TCP)  2667 -> 21284 [PSH, ACK] Seq=65 Ack=1008 Win=8091 Len=8"];
  "81.131.67.131"=>"213.120.62.99" [label="(DNS)  Standard query 0x006a AAAA ftp.ipv6.uni-leipzig.de"];
  "210.146.64.4"=>"81.131.67.131" [label="(TCP)  80 -> 2727 [ACK] Seq=18981 Ack=1 Win=6432 Len=1460"];
  "81.131.67.131"=>"210.146.64.4" [label="(TCP)  2727 -> 80 [ACK] Seq=1 Ack=20441 Win=8760 Len=0"];
  "213.19.160.190"=>"81.131.67.131" [label="(HTTP)  Continuation"];
  "213.120.62.99"=>"81.131.67.131" [label="(DNS)  Standard query response 0x006a AAAA ftp.ipv6.uni-leipzig.de CNAME 6bone.informatik.uni-leipzig.de AAAA 2001:638:902:1:201:2ff:fee2:7596 NS server2.rz.uni-leipzig.de NS ws-kar1.win-ip.dfn.de NS ns.uni-jena.de NS news.uni-leipzig.de A 139.18.1.2"];
  "2002:5183:4383::5183:4383"=>"2001:638:902:1:201:2ff:fee2:7596" [label="(TCP)  1026 -> 21 [SYN] Seq=0 Win=16384 Len=0 MSS=1220"];
  "81.131.67.131"=>"84.56.231.176" [label="(UDP)  41730 -> 6346 Len=19"];
  "81.131.67.131"=>"62.205.109.173" [label="(UDP)  41730 -> 6346 Len=19"];
  "81.131.67.131"=>"80.171.9.79" [label="(UDP)  41730 -> 6346 Len=19"];
  "81.131.67.131"=>"62.131.99.79" [label="(UDP)  41730 -> 6346 Len=19"];
  "81.131.67.131"=>"147.10.31.210" [label="(UDP)  41730 -> 6346 Len=391"];
  "81.131.67.131"=>"213.19.160.190" [label="(TCP)  2810 -> 80 [ACK] Seq=301 Ack=3750 Win=8546 Len=0"];
  "210.146.64.4"=>"81.131.67.131" [label="(TCP)  80 -> 2727 [PSH, ACK] Seq=20441 Ack=1 Win=6432 Len=1460"];
  "81.131.67.131"=>"210.146.64.4" [label="(TCP)  2727 -> 80 [ACK] Seq=1 Ack=21901 Win=8760 Len=0"];
  "211.28.6.30"=>"81.131.67.131" [label="(TCP)  6348 -> 2769 [PSH, ACK] Seq=1 Ack=1 Win=7809 Len=1024"];
  "81.131.67.131"=>"211.28.6.30" [label="(TCP)  2769 -> 6348 [ACK] Seq=1 Ack=1025 Win=8760 Len=0"];
  "210.146.64.4"=>"81.131.67.131" [label="(TCP)  80 -> 2727 [ACK] Seq=21901 Ack=1 Win=6432 Len=1460"];
  "81.131.67.131"=>"210.146.64.4" [label="(TCP)  2727 -> 80 [ACK] Seq=1 Ack=23361 Win=8760 Len=0"];
  "81.131.67.131"=>"24.11.146.28" [label="(TCP)  2675 -> 17342 [PSH, ACK] Seq=1 Ack=1 Win=10164 Len=303"];
  "210.146.64.4"=>"81.131.67.131" [label="(TCP)  80 -> 2727 [ACK] Seq=23361 Ack=1 Win=6432 Len=1460"];
  "81.131.67.131"=>"210.146.64.4" [label="(TCP)  2727 -> 80 [ACK] Seq=1 Ack=24821 Win=8760 Len=0"];
  "81.131.67.131"=>"83.53.165.235" [label="(UDP)  41730 -> 6346 Len=12"];
  "81.131.67.131"=>"84.149.148.25" [label="(UDP)  41730 -> 6346 Len=19"];
  "81.131.67.131"=>"81.161.144.10" [label="(UDP)  41730 -> 6346 Len=19"];
  "81.131.67.131"=>"200.158.81.150" [label="(UDP)  41730 -> 6346 Len=19"];
  "81.131.67.131"=>"195.14.223.213" [label="(UDP)  41730 -> 6346 Len=19"];
  "81.131.67.131"=>"202.133.203.254" [label="(UDP)  41730 -> 6346 Len=19"];
  "81.131.67.131"=>"62.34.123.244" [label="(UDP)  41730 -> 6346 Len=19"];
  "81.131.67.131"=>"218.72.89.80" [label="(UDP)  41730 -> 6346 Len=19"];
  "81.131.67.131"=>"213.189.168.206" [label="(UDP)  41730 -> 6346 Len=19"];
  "81.131.67.131"=>"38.115.4.204" [label="(UDP)  41730 -> 21284 Len=12"];
  "81.131.67.131"=>"68.186.167.166" [label="(UDP)  41730 -> 13778 Len=508"];
  "211.28.6.30"=>"81.131.67.131" [label="(TCP)  6348 -> 2769 [PSH, ACK] Seq=1025 Ack=1 Win=7809 Len=1460"];
  "81.131.67.131"=>"211.28.6.30" [label="(TCP)  2769 -> 6348 [ACK] Seq=1 Ack=2485 Win=8760 Len=0"];
  "210.146.64.4"=>"81.131.67.131" [label="(TCP)  80 -> 2727 [ACK] Seq=24821 Ack=1 Win=6432 Len=1460"];
  "81.131.67.131"=>"210.146.64.4" [label="(TCP)  2727 -> 80 [ACK] Seq=1 Ack=26281 Win=8760 Len=0"];
  "213.120.62.99"=>"81.131.67.131" [label="(DNS)  Standard query response 0x006a AAAA ftp.ipv6.uni-leipzig.de CNAME 6bone.informatik.uni-leipzig.de AAAA 2001:638:902:1:201:2ff:fee2:7596 NS server2.rz.uni-leipzig.de NS ws-kar1.win-ip.dfn.de NS ns.uni-jena.de NS news.uni-leipzig.de A 139.18.1.2"];
  "211.28.6.30"=>"81.131.67.131" [label="(TCP)  6348 -> 2769 [PSH, ACK] Seq=2485 Ack=1 Win=7809 Len=588"];
  "62.203.155.212"=>"81.131.67.131" [label="(ICMP)  Destination unreachable (Port unreachable)"];
  "38.115.4.204"=>"81.131.67.131" [label="(UDP)  21284 -> 41730 Len=12"];
  "81.131.67.131"=>"38.115.4.204" [label="(UDP)  41730 -> 21284 Len=8"];
  "81.131.67.131"=>"211.28.6.30" [label="(TCP)  2769 -> 6348 [ACK] Seq=1 Ack=3073 Win=8172 Len=0"];
  "211.28.6.30"=>"81.131.67.131" [label="(TCP)  6348 -> 2769 [PSH, ACK] Seq=3073 Ack=1 Win=7809 Len=1024"];
  "81.131.67.131"=>"211.28.6.30" [label="(TCP)  2769 -> 6348 [ACK] Seq=1 Ack=4097 Win=8760 Len=0"];
  "38.115.4.204"=>"81.131.67.131" [label="(TCP)  21284 -> 2667 [PSH, ACK] Seq=1008 Ack=65 Win=65471 Len=511"];
  "81.131.67.131"=>"80.144.139.239" [label="(UDP)  41730 -> 6346 Len=19"];
  "81.131.67.131"=>"81.244.90.24" [label="(UDP)  41730 -> 6346 Len=19"];
  "81.131.67.131"=>"219.137.42.1" [label="(UDP)  41730 -> 6346 Len=19"];
  "81.131.67.131"=>"139.168.32.121" [label="(UDP)  41730 -> 6346 Len=19"];
  "81.131.67.131"=>"213.54.85.41" [label="(UDP)  41730 -> 6346 Len=19"];
  "81.131.67.131"=>"82.192.36.209" [label="(UDP)  41730 -> 6346 Len=19"];
  "81.131.67.131"=>"24.43.167.12" [label="(UDP)  41730 -> 6346 Len=19"];
  "81.131.67.131"=>"81.247.65.177" [label="(UDP)  41730 -> 6346 Len=19"];
  "81.131.67.131"=>"83.117.6.35" [label="(UDP)  41730 -> 6346 Len=19"];
  "81.131.67.131"=>"195.130.143.128" [label="(UDP)  41730 -> 6346 Len=19"];
  "211.28.6.30"=>"81.131.67.131" [label="(TCP)  6348 -> 2769 [PSH, ACK] Seq=4097 Ack=1 Win=7809 Len=1460"];
  "81.131.67.131"=>"212.194.202.220" [label="(UDP)  41730 -> 6346 Len=19"];
  "81.131.67.131"=>"82.216.238.111" [label="(UDP)  41730 -> 28046 Len=19"];
  "81.131.67.131"=>"38.115.4.204" [label="(UDP)  41730 -> 21284 Len=12"];
  "81.131.67.131"=>"38.115.4.204" [label="(TCP)  2667 -> 21284 [ACK] Seq=73 Ack=1519 Win=7580 Len=0"];
  "213.120.62.99"=>"81.131.67.131" [label="(DNS)  Standard query response 0x006a AAAA ftp.ipv6.uni-leipzig.de CNAME 6bone.informatik.uni-leipzig.de AAAA 2001:638:902:1:201:2ff:fee2:7596 NS news.uni-leipzig.de NS server2.rz.uni-leipzig.de NS ws-kar1.win-ip.dfn.de NS ns.uni-jena.de A 139.18.1.2"];
  "81.131.67.131"=>"211.28.6.30" [label="(TCP)  2769 -> 6348 [ACK] Seq=1 Ack=5557 Win=8760 Len=0"];
  "210.146.64.4"=>"81.131.67.131" [label="(TCP)  80 -> 2727 [PSH, ACK] Seq=26281 Ack=1 Win=6432 Len=1460"];
  "38.115.4.204"=>"81.131.67.131" [label="(TCP)  21284 -> 2667 [ACK] Seq=1519 Ack=73 Win=65463 Len=0"];
  "81.131.67.131"=>"38.115.4.204" [label="(TCP)  2667 -> 21284 [PSH, ACK] Seq=73 Ack=1519 Win=7580 Len=8"];
  "2001:638:902:1:201:2ff:fee2:7596"=>"2002:5183:4383::5183:4383" [label="(TCP)  21 -> 1026 [SYN, ACK] Seq=0 Ack=1 Win=32768 Len=0 MSS=1440"];
  "81.131.67.131"=>"210.146.64.4" [label="(TCP)  2727 -> 80 [ACK] Seq=1 Ack=27741 Win=8760 Len=0"];
  "2002:5183:4383::5183:4383"=>"2001:638:902:1:201:2ff:fee2:7596" [label="(TCP)  1026 -> 21 [ACK] Seq=1 Ack=1 Win=17080 Len=0"];
  "210.146.64.4"=>"81.131.67.131" [label="(TCP)  80 -> 2727 [ACK] Seq=27741 Ack=1 Win=6432 Len=1460"];
  "81.131.67.131"=>"210.146.64.4" [label="(TCP)  2727 -> 80 [ACK] Seq=1 Ack=29201 Win=8760 Len=0"];
  "81.131.67.131"=>"207.148.176.7" [label="(UDP)  41730 -> 6346 Len=19"];
  "81.131.67.131"=>"62.193.101.150" [label="(UDP)  41730 -> 6346 Len=19"];
  "81.131.67.131"=>"212.129.214.254" [label="(UDP)  41730 -> 6346 Len=19"];
  "211.28.6.30"=>"81.131.67.131" [label="(TCP)  6348 -> 2769 [PSH, ACK] Seq=5557 Ack=1 Win=7809 Len=1460"];
  "81.131.67.131"=>"172.177.184.179" [label="(UDP)  41730 -> 6346 Len=19"];
  "81.131.67.131"=>"172.186.173.245" [label="(UDP)  41730 -> 6346 Len=19"];
  "211.28.6.30"=>"81.131.67.131" [label="(TCP)  6348 -> 2769 [PSH, ACK] Seq=7017 Ack=1 Win=7809 Len=152"];
  "81.131.67.131"=>"207.216.13.37" [label="(UDP)  41730 -> 6346 Len=19"];
  "81.131.67.131"=>"85.96.110.115" [label="(UDP)  41730 -> 6346 Len=19"];
  "81.131.67.131"=>"83.112.25.172" [label="(UDP)  41730 -> 6346 Len=19"];
  "81.131.67.131"=>"68.186.167.166" [label="(UDP)  41730 -> 13778 Len=508"];
  "81.131.67.131"=>"82.44.146.72" [label="(UDP)  41730 -> 34087 Len=19"];
  "81.131.67.131"=>"211.28.6.30" [label="(TCP)  2769 -> 6348 [ACK] Seq=1 Ack=7017 Win=8760 Len=0"];
  "81.131.67.131"=>"24.11.146.28" [label="(UDP)  41730 -> 17342 Len=12"];
  "81.131.67.131"=>"211.28.6.30" [label="(TCP)  2769 -> 6348 [ACK] Seq=1 Ack=7169 Win=8608 Len=0"];
  "210.146.64.4"=>"81.131.67.131" [label="(TCP)  80 -> 2727 [PSH, ACK] Seq=29201 Ack=1 Win=6432 Len=1460"];
  "147.10.31.210"=>"81.131.67.131" [label="(UDP)  6346 -> 41730 Len=8"];
  "81.131.67.131"=>"210.146.64.4" [label="(TCP)  2727 -> 80 [ACK] Seq=1 Ack=30661 Win=8760 Len=0"];
  "81.131.67.131"=>"69.227.71.60" [label="(UDP)  6348 -> 6346 Len=33"];
  "81.131.67.131"=>"70.27.127.185" [label="(TCP)  2094 -> 6346 [ACK] Seq=1 Ack=117 Win=7809 Len=0"];
  "210.146.64.4"=>"81.131.67.131" [label="(TCP)  80 -> 2727 [ACK] Seq=30661 Ack=1 Win=6432 Len=1460"];
  "24.11.146.28"=>"81.131.67.131" [label="(TCP)  17342 -> 2675 [ACK] Seq=2031 Ack=304 Win=64376 Len=0"];
  "81.131.67.131"=>"24.11.146.28" [label="(TCP)  2675 -> 17342 [PSH, ACK] Seq=304 Ack=1 Win=10164 Len=8"];
  "81.131.67.131"=>"210.146.64.4" [label="(TCP)  2727 -> 80 [ACK] Seq=1 Ack=32121 Win=8760 Len=0"];
  "210.146.64.4"=>"81.131.67.131" [label="(TCP)  80 -> 2727 [ACK] Seq=32121 Ack=1 Win=6432 Len=1460"];
  "81.131.67.131"=>"210.146.64.4" [label="(TCP)  2727 -> 80 [ACK] Seq=1 Ack=33581 Win=8760 Len=0"];
  "200.158.81.150"=>"81.131.67.131" [label="(ICMP)  Destination unreachable (Port unreachable)"];
  "81.131.67.131"=>"24.11.146.28" [label="(UDP)  41730 -> 17342 Len=12"];
  "81.131.67.131"=>"82.10.189.102" [label="(UDP)  41730 -> 6346 Len=19"];
  "81.131.67.131"=>"62.203.155.212" [label="(UDP)  41730 -> 6346 Len=19"];
  "81.131.67.131"=>"83.132.177.64" [label="(UDP)  41730 -> 6346 Len=19"];
  "81.131.67.131"=>"68.186.167.166" [label="(UDP)  41730 -> 13778 Len=508"];
  "210.146.64.4"=>"81.131.67.131" [label="(TCP)  80 -> 2727 [ACK] Seq=33581 Ack=1 Win=6432 Len=1460"];
  "81.131.67.131"=>"210.146.64.4" [label="(TCP)  2727 -> 80 [ACK] Seq=1 Ack=35041 Win=8760 Len=0"];
  "82.192.36.209"=>"81.131.67.131" [label="(UDP)  6346 -> 41730 Len=8"];
  "38.115.4.204"=>"81.131.67.131" [label="(TCP)  21284 -> 2667 [PSH, ACK] Seq=1519 Ack=81 Win=65455 Len=711"];
  "2001:638:902:1:201:2ff:fee2:7596"=>"2002:5183:4383::5183:4383" [label="(FTP)  Response: 220-"];
  "81.131.67.131"=>"38.115.4.204" [label="(TCP)  2667 -> 21284 [ACK] Seq=81 Ack=2230 Win=8760 Len=0"];
  "81.131.67.131"=>"38.115.4.204" [label="(TCP)  2667 -> 21284 [PSH, ACK] Seq=81 Ack=2230 Win=8760 Len=8"];
  "81.131.67.131"=>"142.68.189.57" [label="(TCP)  1595 -> 6346 [ACK] Seq=1 Ack=107 Win=8760 Len=0"];
  "2002:5183:4383::5183:4383"=>"2001:638:902:1:201:2ff:fee2:7596" [label="(TCP)  1026 -> 21 [ACK] Seq=1 Ack=7 Win=17074 Len=0"];
  "210.146.64.4"=>"81.131.67.131" [label="(TCP)  80 -> 2727 [PSH, ACK] Seq=35041 Ack=1 Win=6432 Len=1460"];
  "81.131.67.131"=>"210.146.64.4" [label="(TCP)  2727 -> 80 [ACK] Seq=1 Ack=36501 Win=8760 Len=0"];
  "83.53.165.235"=>"81.131.67.131" [label="(UDP)  6346 -> 41730 Len=8"];
  "83.53.165.235"=>"81.131.67.131" [label="(UDP)  6346 -> 41730 Len=12"];
  "81.131.67.131"=>"83.53.165.235" [label="(UDP)  41730 -> 6346 Len=8"];
  "210.146.64.4"=>"81.131.67.131" [label="(TCP)  80 -> 2727 [ACK] Seq=36501 Ack=1 Win=6432 Len=1460"];
  "81.131.67.131"=>"210.146.64.4" [label="(TCP)  2727 -> 80 [ACK] Seq=1 Ack=37961 Win=8760 Len=0"];
  "70.27.127.185"=>"81.131.67.131" [label="(Gnutella)  [TCP Spurious Retransmission]"];
  "81.131.67.131"=>"70.27.127.185" [label="(TCP)  [TCP Dup ACK 180#1] 2094 -> 6346 [ACK] Seq=1 Ack=117 Win=7809 Len=0"];
  "211.28.6.30"=>"81.131.67.131" [label="(TCP)  6348 -> 2769 [ACK] Seq=7169 Ack=1 Win=7809 Len=1004"];
  "81.131.67.131"=>"139.55.21.35" [label="(UDP)  41730 -> 63346 Len=386"];
  "81.131.67.131"=>"211.28.6.30" [label="(TCP)  2769 -> 6348 [ACK] Seq=1 Ack=8173 Win=7604 Len=0"];
  "210.146.64.4"=>"81.131.67.131" [label="(TCP)  80 -> 2727 [PSH, ACK] Seq=37961 Ack=1 Win=6432 Len=1460"];
  "81.131.67.131"=>"210.146.64.4" [label="(TCP)  2727 -> 80 [ACK] Seq=1 Ack=39421 Win=8760 Len=0"];
  "210.146.64.4"=>"81.131.67.131" [label="(TCP)  80 -> 2727 [ACK] Seq=39421 Ack=1 Win=6432 Len=1460"];
  "24.11.146.28"=>"81.131.67.131" [label="(TCP)  17342 -> 2675 [ACK] Seq=2031 Ack=312 Win=64368 Len=0"];
  "81.131.67.131"=>"210.146.64.4" [label="(TCP)  2727 -> 80 [ACK] Seq=1 Ack=40881 Win=8760 Len=0"];
  "68.34.169.230"=>"81.131.67.131" [label="(TCP)  6346 -> 2433 [PSH, ACK] Seq=53 Ack=1 Win=64332 Len=34 [TCP segment of a reassembled PDU]"];
  "213.19.160.190"=>"81.131.67.131" [label="(TCP)  80 -> 2810 [FIN, ACK] Seq=3750 Ack=301 Win=6432 Len=0"];
  "81.131.67.131"=>"213.19.160.190" [label="(TCP)  2810 -> 80 [ACK] Seq=301 Ack=3751 Win=8546 Len=0"];
  "81.131.67.131"=>"68.34.169.230" [label="(TCP)  2433 -> 6346 [ACK] Seq=1 Ack=87 Win=7958 Len=0"];
  "210.146.64.4"=>"81.131.67.131" [label="(TCP)  80 -> 2727 [ACK] Seq=40881 Ack=1 Win=6432 Len=1460"];
  "81.131.67.131"=>"210.146.64.4" [label="(TCP)  2727 -> 80 [ACK] Seq=1 Ack=42341 Win=8760 Len=0"];
  "2001:638:902:1:201:2ff:fee2:7596"=>"2002:5183:4383::5183:4383" [label="(FTP)  Response: 220 6bone.informatik.uni-leipzig.de FTP server (NetBSD-ftpd 20041119) ready."];
  "2002:5183:4383::5183:4383"=>"2001:638:902:1:201:2ff:fee2:7596" [label="(FTP)  Request: USER anonymous"];
  "38.115.4.204"=>"81.131.67.131" [label="(TCP)  21284 -> 2667 [PSH, ACK] Seq=2230 Ack=89 Win=65447 Len=63"];
  "81.131.67.131"=>"38.115.4.204" [label="(TCP)  2667 -> 21284 [PSH, ACK] Seq=89 Ack=2293 Win=8697 Len=8"];
  "81.131.67.131"=>"142.68.189.57" [label="(TCP)  1595 -> 6346 [ACK] Seq=1 Ack=166 Win=8701 Len=0"];
  "81.131.67.131"=>"213.224.41.203" [label="(UDP)  41730 -> 6346 Len=19"];
  "81.131.67.131"=>"69.4.150.232" [label="(UDP)  41730 -> 6346 Len=19"];
  "81.131.67.131"=>"65.43.223.20" [label="(UDP)  41730 -> 6346 Len=19"];
  "81.131.67.131"=>"151.37.67.40" [label="(UDP)  41730 -> 6346 Len=19"];
  "81.131.67.131"=>"80.125.99.71" [label="(UDP)  41730 -> 6346 Len=19"];
  "81.131.67.131"=>"82.92.21.6" [label="(UDP)  41730 -> 6346 Len=19"];
  "81.131.67.131"=>"84.156.173.210" [label="(UDP)  41730 -> 6346 Len=19"];
  "81.131.67.131"=>"82.92.79.199" [label="(UDP)  41730 -> 6346 Len=19"];
  "210.146.64.4"=>"81.131.67.131" [label="(TCP)  80 -> 2727 [ACK] Seq=42341 Ack=1 Win=6432 Len=1460"];
  "81.131.67.131"=>"68.21.34.173" [label="(UDP)  41730 -> 6346 Len=19"];
  "81.131.67.131"=>"81.241.94.212" [label="(UDP)  41730 -> 6346 Len=19"];
  "81.131.67.131"=>"82.171.96.179" [label="(UDP)  41730 -> 6346 Len=19"];
  "81.131.67.131"=>"84.97.114.126" [label="(UDP)  41730 -> 6347 Len=19"];
  "81.131.67.131"=>"210.146.64.4" [label="(TCP)  2727 -> 80 [ACK] Seq=1 Ack=43801 Win=8760 Len=0"];
  "81.131.67.131"=>"70.27.127.185" [label="(TCP)  2094 -> 6346 [ACK] Seq=1 Ack=151 Win=7775 Len=0"];
  "210.146.64.4"=>"81.131.67.131" [label="(TCP)  80 -> 2727 [PSH, ACK] Seq=43801 Ack=1 Win=6432 Len=1460"];
  "81.131.67.131"=>"210.146.64.4" [label="(TCP)  2727 -> 80 [ACK] Seq=1 Ack=45261 Win=8760 Len=0"];
  "211.28.6.30"=>"81.131.67.131" [label="(TCP)  6348 -> 2769 [PSH, ACK] Seq=8173 Ack=1 Win=7809 Len=1044"];
  "81.131.67.131"=>"211.28.6.30" [label="(TCP)  2769 -> 6348 [ACK] Seq=1 Ack=9217 Win=8760 Len=0"];
  "62.203.155.212"=>"81.131.67.131" [label="(ICMP)  Destination unreachable (Port unreachable)"];
  "210.146.64.4"=>"81.131.67.131" [label="(TCP)  80 -> 2727 [ACK] Seq=45261 Ack=1 Win=6432 Len=1460"];
  "81.131.67.131"=>"210.146.64.4" [label="(TCP)  2727 -> 80 [ACK] Seq=1 Ack=46721 Win=8760 Len=0"];
  "211.28.6.30"=>"81.131.67.131" [label="(TCP)  6348 -> 2769 [PSH, ACK] Seq=9217 Ack=1 Win=7809 Len=1024"];
  "81.131.67.131"=>"80.185.105.19" [label="(UDP)  41730 -> 6346 Len=19"];
  "81.131.67.131"=>"83.117.2.56" [label="(UDP)  41730 -> 2424 Len=508"];
  "81.131.67.131"=>"211.28.6.30" [label="(TCP)  2769 -> 6348 [ACK] Seq=1 Ack=10241 Win=7736 Len=0"];
  "210.146.64.4"=>"81.131.67.131" [label="(TCP)  80 -> 2727 [PSH, ACK] Seq=46721 Ack=1 Win=6432 Len=1460"];
  "68.34.169.230"=>"81.131.67.131" [label="(TCP)  6346 -> 2433 [PSH, ACK] Seq=87 Ack=1 Win=64332 Len=38 [TCP segment of a reassembled PDU]"];
  "81.131.67.131"=>"210.146.64.4" [label="(TCP)  2727 -> 80 [ACK] Seq=1 Ack=48181 Win=8760 Len=0"];
  "81.131.67.131"=>"68.34.169.230" [label="(TCP)  2433 -> 6346 [ACK] Seq=1 Ack=125 Win=7920 Len=0"];
  "210.146.64.4"=>"81.131.67.131" [label="(TCP)  80 -> 2727 [ACK] Seq=48181 Ack=1 Win=6432 Len=1460"];
  "81.131.67.131"=>"210.146.64.4" [label="(TCP)  2727 -> 80 [ACK] Seq=1 Ack=49641 Win=8760 Len=0"];
  "83.53.165.235"=>"81.131.67.131" [label="(TCP)  6346 -> 1677 [RST] Seq=1 Win=0 Len=0"];
  "81.131.67.131"=>"83.53.165.235" [label="(TCP)  2813 -> 6346 [SYN] Seq=0 Win=8760 Len=0 MSS=1460 SACK_PERM=1"];
  "2001:638:902:1:201:2ff:fee2:7596"=>"2002:5183:4383::5183:4383" [label="(FTP)  Response: 331 Guest login ok, type your name as password."];
  "2002:5183:4383::5183:4383"=>"2001:638:902:1:201:2ff:fee2:7596" [label="(FTP)  Request: PASS IEUser@"];
  "81.131.67.131"=>"82.232.4.28" [label="(TCP)  2814 -> 6346 [SYN] Seq=0 Win=8760 Len=0 MSS=1460 SACK_PERM=1"];
  "210.146.64.4"=>"81.131.67.131" [label="(TCP)  80 -> 2727 [ACK] Seq=49641 Ack=1 Win=6432 Len=1460"];
  "81.131.67.131"=>"210.146.64.4" [label="(TCP)  2727 -> 80 [ACK] Seq=1 Ack=51101 Win=8760 Len=0"];
  "38.115.4.204"=>"81.131.67.131" [label="(TCP)  21284 -> 2667 [PSH, ACK] Seq=2293 Ack=97 Win=65439 Len=350"];
  "81.131.67.131"=>"38.115.4.204" [label="(TCP)  2667 -> 21284 [PSH, ACK] Seq=97 Ack=2643 Win=8347 Len=8"];
  "213.224.41.203"=>"81.131.67.131" [label="(UDP)  6346 -> 41730 Len=8"];
  "81.131.67.131"=>"142.68.189.57" [label="(TCP)  1595 -> 6346 [ACK] Seq=1 Ack=236 Win=10080 Len=0"];
  "81.131.67.131"=>"62.167.89.152" [label="(UDP)  41730 -> 6346 Len=19"];
  "81.131.67.131"=>"83.117.2.56" [label="(UDP)  41730 -> 2424 Len=35"];
  "81.131.67.131"=>"85.135.146.10" [label="(UDP)  41730 -> 6346 Len=19"];
  "81.131.67.131"=>"80.144.139.239" [label="(UDP)  41730 -> 6346 Len=19"];
  "81.131.67.131"=>"81.244.90.24" [label="(UDP)  41730 -> 6346 Len=19"];
  "210.146.64.4"=>"81.131.67.131" [label="(TCP)  80 -> 2727 [ACK] Seq=51101 Ack=1 Win=6432 Len=1460"];
  "84.97.114.126"=>"81.131.67.131" [label="(ICMP)  Destination unreachable (Port unreachable)"];
  "81.131.67.131"=>"219.137.42.1" [label="(UDP)  41730 -> 6346 Len=19"];
  "81.131.67.131"=>"83.116.155.57" [label="(UDP)  41730 -> 6346 Len=19"];
  "81.131.67.131"=>"84.101.247.219" [label="(UDP)  41730 -> 6346 Len=19"];
  "81.131.67.131"=>"218.86.72.220" [label="(UDP)  41730 -> 36389 Len=19"];
  "81.131.67.131"=>"80.186.123.15" [label="(TCP)  2815 -> 6346 [SYN] Seq=0 Win=8760 Len=0 MSS=1460 SACK_PERM=1"];
  "81.131.67.131"=>"60.224.255.117" [label="(UDP)  41730 -> 40682 Len=19"];
  "81.131.67.131"=>"68.6.198.57" [label="(UDP)  41730 -> 6347 Len=19"];
  "81.131.67.131"=>"210.146.64.4" [label="(TCP)  2727 -> 80 [ACK] Seq=1 Ack=52561 Win=8760 Len=0"];
  "81.131.67.131"=>"172.187.62.41" [label="(TCP)  2816 -> 6346 [SYN] Seq=0 Win=8760 Len=0 MSS=1460 SACK_PERM=1"];
  "211.28.6.30"=>"81.131.67.131" [label="(TCP)  6348 -> 2769 [PSH, ACK] Seq=10241 Ack=1 Win=7809 Len=1460"];
  "81.131.67.131"=>"211.28.6.30" [label="(TCP)  2769 -> 6348 [ACK] Seq=1 Ack=11701 Win=8760 Len=0"];
  "81.131.67.131"=>"65.184.193.172" [label="(TCP)  2817 -> 33580 [SYN] Seq=0 Win=8760 Len=0 MSS=1460 SACK_PERM=1"];
  "210.146.64.4"=>"81.131.67.131" [label="(TCP)  80 -> 2727 [ACK] Seq=52561 Ack=1 Win=6432 Len=1460"];
  "24.11.146.28"=>"81.131.67.131" [label="(UDP)  17342 -> 41730 Len=12"];
  "81.131.67.131"=>"210.146.64.4" [label="(TCP)  2727 -> 80 [ACK] Seq=1 Ack=54021 Win=8760 Len=0"];
  "81.131.67.131"=>"24.11.146.28" [label="(UDP)  41730 -> 17342 Len=8"];
  "211.28.6.30"=>"81.131.67.131" [label="(TCP)  6348 -> 2769 [PSH, ACK] Seq=11701 Ack=1 Win=7809 Len=588"];
  "67.111.163.61"=>"81.131.67.131" [label="(Messenger)  NetrSendMessage request"];
  "81.131.67.131"=>"67.111.163.61" [label="(ICMP)  Destination unreachable (Port unreachable)"];
  "62.74.99.96"=>"81.131.67.131" [label="(TCP)  2588 -> 1216 [SYN] Seq=0 Win=16384 Len=0 MSS=1460 SACK_PERM=1"];
  "81.131.67.131"=>"62.74.99.96" [label="(TCP)  1216 -> 2588 [RST, ACK] Seq=1 Ack=1 Win=0 Len=0"];
  "81.131.67.131"=>"211.28.6.30" [label="(TCP)  2769 -> 6348 [ACK] Seq=1 Ack=12289 Win=8172 Len=0"];
  "81.131.67.131"=>"24.11.146.28" [label="(UDP)  41730 -> 17342 Len=12"];
  "81.131.67.131"=>"38.115.4.204" [label="(UDP)  41730 -> 21284 Len=12"];
  "81.131.67.131"=>"38.115.4.204" [label="(UDP)  41730 -> 21284 Len=12"];
  "81.131.67.131"=>"139.168.32.121" [label="(UDP)  41730 -> 6346 Len=19"];
  "81.131.67.131"=>"213.54.85.41" [label="(UDP)  41730 -> 6346 Len=19"];
  "81.131.67.131"=>"84.56.231.176" [label="(UDP)  41730 -> 6346 Len=19"];
  "81.131.67.131"=>"62.205.109.173" [label="(UDP)  41730 -> 6346 Len=19"];
  "81.131.67.131"=>"80.171.9.79" [label="(UDP)  41730 -> 6346 Len=19"];
  "81.131.67.131"=>"62.131.99.79" [label="(UDP)  41730 -> 6346 Len=19"];
  "81.131.67.131"=>"84.149.148.25" [label="(UDP)  41730 -> 6346 Len=19"];
  "81.131.67.131"=>"81.161.144.10" [label="(UDP)  41730 -> 6346 Len=19"];
  "81.131.67.131"=>"24.43.167.12" [label="(UDP)  41730 -> 6346 Len=19"];
  "81.131.67.131"=>"82.216.238.111" [label="(UDP)  41730 -> 28046 Len=19"];
  "210.146.64.4"=>"81.131.67.131" [label="(TCP)  80 -> 2727 [ACK] Seq=54021 Ack=1 Win=6432 Len=1460"];
  "81.131.67.131"=>"210.146.64.4" [label="(TCP)  2727 -> 80 [ACK] Seq=1 Ack=55481 Win=8760 Len=0"];
  "211.28.6.30"=>"81.131.67.131" [label="(TCP)  6348 -> 2769 [PSH, ACK] Seq=12289 Ack=1 Win=7809 Len=1024"];
  "81.131.67.131"=>"211.28.6.30" [label="(TCP)  2769 -> 6348 [ACK] Seq=1 Ack=13313 Win=8760 Len=0"];
  "83.117.2.56"=>"81.131.67.131" [label="(UDP)  2424 -> 41730 Len=8"];
  "68.34.169.230"=>"81.131.67.131" [label="(TCP)  6346 -> 2433 [PSH, ACK] Seq=125 Ack=1 Win=64332 Len=27 [TCP segment of a reassembled PDU]"];
  "81.131.67.131"=>"68.34.169.230" [label="(TCP)  2433 -> 6346 [ACK] Seq=1 Ack=152 Win=7893 Len=0"];
  "210.146.64.4"=>"81.131.67.131" [label="(TCP)  80 -> 2727 [PSH, ACK] Seq=55481 Ack=1 Win=6432 Len=1460"];
  "81.131.67.131"=>"210.146.64.4" [label="(TCP)  2727 -> 80 [ACK] Seq=1 Ack=56941 Win=8760 Len=0"];
  "2001:638:902:1:201:2ff:fee2:7596"=>"2002:5183:4383::5183:4383" [label="(FTP)  Response: 230 Guest login ok, access restrictions apply."];
  "2002:5183:4383::5183:4383"=>"2001:638:902:1:201:2ff:fee2:7596" [label="(FTP)  Request: opts utf8 on"];
  "210.146.64.4"=>"81.131.67.131" [label="(TCP)  80 -> 2727 [ACK] Seq=56941 Ack=1 Win=6432 Len=1460"];
  "81.131.67.131"=>"210.146.64.4" [label="(TCP)  2727 -> 80 [ACK] Seq=1 Ack=58401 Win=8760 Len=0"];
  "81.131.67.131"=>"24.11.146.28" [label="(UDP)  41730 -> 17342 Len=12"];
  "81.131.67.131"=>"81.247.65.177" [label="(UDP)  41730 -> 6346 Len=19"];
  "81.131.67.131"=>"83.117.6.35" [label="(UDP)  41730 -> 6346 Len=19"];
  "81.131.67.131"=>"195.130.143.128" [label="(UDP)  41730 -> 6346 Len=19"];
  "81.131.67.131"=>"212.194.202.220" [label="(UDP)  41730 -> 6346 Len=19"];
  "81.131.67.131"=>"207.148.176.7" [label="(UDP)  41730 -> 6346 Len=19"];
  "81.131.67.131"=>"62.193.101.150" [label="(UDP)  41730 -> 6346 Len=19"];
  "81.131.67.131"=>"212.129.214.254" [label="(UDP)  41730 -> 6346 Len=19"];
  "81.131.67.131"=>"200.158.81.150" [label="(UDP)  41730 -> 6346 Len=19"];
  "81.131.67.131"=>"82.10.189.102" [label="(UDP)  41730 -> 6346 Len=19"];
  "81.131.67.131"=>"62.203.155.212" [label="(UDP)  41730 -> 6346 Len=19"];
  "81.131.67.131"=>"83.132.177.64" [label="(UDP)  41730 -> 6346 Len=19"];
  "81.131.67.131"=>"213.19.160.190" [label="(TCP)  2818 -> 80 [SYN] Seq=0 Win=8760 Len=0 MSS=1460 SACK_PERM=1"];
  "81.131.67.131"=>"38.115.4.204" [label="(UDP)  41730 -> 21284 Len=12"];
  "81.131.67.131"=>"142.68.189.57" [label="(TCP)  1595 -> 6346 [ACK] Seq=1 Ack=271 Win=10045 Len=0"];
  "81.131.67.131"=>"213.19.160.190" [label="(TCP)  2810 -> 80 [RST] Seq=301 Win=0 Len=0"];
  "81.131.67.131"=>"70.27.127.185" [label="(TCP)  2094 -> 6346 [ACK] Seq=1 Ack=194 Win=7732 Len=0"];
  "38.115.4.204"=>"81.131.67.131" [label="(TCP)  21284 -> 2667 [PSH, ACK] Seq=2643 Ack=105 Win=65431 Len=1226"];
  "81.131.67.131"=>"38.115.4.204" [label="(TCP)  2667 -> 21284 [PSH, ACK] Seq=105 Ack=3869 Win=7121 Len=8"];
  "81.131.67.131"=>"38.115.4.204" [label="(TCP)  [TCP Window Update] 2667 -> 21284 [ACK] Seq=113 Ack=3869 Win=8760 Len=0"];
  "82.232.4.28"=>"81.131.67.131" [label="(TCP)  6346 -> 2814 [SYN, ACK] Seq=0 Ack=1 Win=17520 Len=0 MSS=1460 SACK_PERM=1"];
  "81.131.67.131"=>"83.53.165.235" [label="(TCP)  [TCP Retransmission] 2813 -> 6346 [SYN] Seq=0 Win=8760 Len=0 MSS=1460 SACK_PERM=1"];
  "81.131.67.131"=>"82.232.4.28" [label="(TCP)  2814 -> 6346 [ACK] Seq=1 Ack=1 Win=8760 Len=0"];
  "210.146.64.4"=>"81.131.67.131" [label="(TCP)  80 -> 2727 [ACK] Seq=58401 Ack=1 Win=6432 Len=1460"];
  "83.117.2.56"=>"81.131.67.131" [label="(UDP)  2424 -> 41730 Len=8"];
  "84.101.247.219"=>"81.131.67.131" [label="(UDP)  6346 -> 41730 Len=8"];
  "81.131.67.131"=>"210.146.64.4" [label="(TCP)  2727 -> 80 [ACK] Seq=1 Ack=59861 Win=8760 Len=0"];
  "210.146.64.4"=>"81.131.67.131" [label="(TCP)  80 -> 2727 [ACK] Seq=59861 Ack=1 Win=6432 Len=1460"];
  "81.131.67.131"=>"210.146.64.4" [label="(TCP)  2727 -> 80 [ACK] Seq=1 Ack=61321 Win=8760 Len=0"];
  "81.131.67.131"=>"80.186.123.15" [label="(TCP)  [TCP Retransmission] 2815 -> 6346 [SYN] Seq=0 Win=8760 Len=0 MSS=1460 SACK_PERM=1"];
  "211.28.6.30"=>"81.131.67.131" [label="(TCP)  6348 -> 2769 [PSH, ACK] Seq=13313 Ack=1 Win=7809 Len=1024"];
  "219.137.42.1"=>"81.131.67.131" [label="(ICMP)  Destination unreachable (Port unreachable)"];
  "60.224.255.117"=>"81.131.67.131" [label="(UDP)  40682 -> 41730 Len=8"];
  "65.184.193.172"=>"81.131.67.131" [label="(TCP)  33580 -> 2817 [SYN, ACK] Seq=0 Ack=1 Win=64240 Len=0 MSS=1460 SACK_PERM=1"];
  "81.131.67.131"=>"65.184.193.172" [label="(TCP)  2817 -> 33580 [ACK] Seq=1 Ack=1 Win=8760 Len=0"];
  "81.131.67.131"=>"84.84.15.199" [label="(UDP)  41730 -> 15492 Len=476"];
  "81.131.67.131"=>"65.184.193.172" [label="(TCP)  2817 -> 33580 [PSH, ACK] Seq=1 Ack=1 Win=8760 Len=223"];
  "81.131.67.131"=>"172.187.62.41" [label="(TCP)  [TCP Retransmission] 2816 -> 6346 [SYN] Seq=0 Win=8760 Len=0 MSS=1460 SACK_PERM=1"];
  "81.131.67.131"=>"211.28.6.30" [label="(TCP)  2769 -> 6348 [ACK] Seq=1 Ack=14337 Win=7736 Len=0"];
  "211.28.6.30"=>"81.131.67.131" [label="(TCP)  6348 -> 2769 [PSH, ACK] Seq=14337 Ack=1 Win=7809 Len=1024"];
  "81.131.67.131"=>"211.28.6.30" [label="(TCP)  2769 -> 6348 [ACK] Seq=1 Ack=15361 Win=8760 Len=0"];
  "210.146.64.4"=>"81.131.67.131" [label="(TCP)  80 -> 2727 [ACK] Seq=61321 Ack=1 Win=6432 Len=1460"];
  "24.11.146.28"=>"81.131.67.131" [label="(UDP)  17342 -> 41730 Len=8"];
  "81.131.67.131"=>"210.146.64.4" [label="(TCP)  2727 -> 80 [ACK] Seq=1 Ack=62781 Win=8760 Len=0"];
  "210.146.64.4"=>"81.131.67.131" [label="(TCP)  80 -> 2727 [ACK] Seq=62781 Ack=1 Win=6432 Len=1460"];
  "81.131.67.131"=>"210.146.64.4" [label="(TCP)  2727 -> 80 [ACK] Seq=1 Ack=64241 Win=8760 Len=0"];
  "62.74.99.96"=>"81.131.67.131" [label="(TCP)  [TCP Retransmission] 2588 -> 1216 [SYN] Seq=0 Win=16384 Len=0 MSS=1460 SACK_PERM=1"];
  "68.34.169.230"=>"81.131.67.131" [label="(TCP)  6346 -> 2433 [PSH, ACK] Seq=152 Ack=1 Win=64332 Len=45 [TCP segment of a reassembled PDU]"];
  "81.131.67.131"=>"62.74.99.96" [label="(TCP)  1216 -> 2588 [RST, ACK] Seq=1 Ack=1 Win=0 Len=0"];
  "2001:638:902:1:201:2ff:fee2:7596"=>"2002:5183:4383::5183:4383" [label="(FTP)  Response: 502 Unknown command 'utf8'."];
  "2002:5183:4383::5183:4383"=>"2001:638:902:1:201:2ff:fee2:7596" [label="(FTP)  Request: syst"];
  "83.53.165.235"=>"81.131.67.131" [label="(TCP)  6346 -> 2813 [SYN, ACK] Seq=0 Ack=1 Win=17424 Len=0 MSS=1452 SACK_PERM=1"];
  "81.131.67.131"=>"83.53.165.235" [label="(TCP)  2813 -> 6346 [ACK] Seq=1 Ack=1 Win=10164 Len=0"];
  "81.131.67.131"=>"68.34.169.230" [label="(TCP)  2433 -> 6346 [ACK] Seq=1 Ack=197 Win=7848 Len=0"];
  "81.131.67.131"=>"69.4.150.232" [label="(UDP)  41730 -> 6346 Len=19"];
  "81.131.67.131"=>"65.43.223.20" [label="(UDP)  41730 -> 6346 Len=19"];
  "81.131.67.131"=>"151.37.67.40" [label="(UDP)  41730 -> 6346 Len=19"];
  "81.131.67.131"=>"80.125.99.71" [label="(UDP)  41730 -> 6346 Len=19"];
  "81.131.67.131"=>"82.92.21.6" [label="(UDP)  41730 -> 6346 Len=19"];
  "81.131.67.131"=>"139.55.21.35" [label="(UDP)  41730 -> 63346 Len=386"];
  "210.146.64.4"=>"81.131.67.131" [label="(TCP)  80 -> 2727 [PSH, ACK] Seq=64241 Ack=1 Win=6432 Len=1460"];
  "213.19.160.190"=>"81.131.67.131" [label="(TCP)  80 -> 2818 [SYN, ACK] Seq=0 Ack=1 Win=5840 Len=0 MSS=1460 SACK_PERM=1"];
  "81.131.67.131"=>"213.19.160.190" [label="(TCP)  2818 -> 80 [ACK] Seq=1 Ack=1 Win=8760 Len=0"];
  "81.131.67.131"=>"210.146.64.4" [label="(TCP)  2727 -> 80 [ACK] Seq=1 Ack=65701 Win=8760 Len=0"];
  "81.131.67.131"=>"213.19.160.190" [label="(HTTP)  GET /msdownload/update/v5/psf/windowsxp-sp2-x86fre-usa-2180_056b2b38baf5620be85ddd58141b073bc0b06a1d.psf HTTP/1.1"];
  "210.146.64.4"=>"81.131.67.131" [label="(TCP)  80 -> 2727 [ACK] Seq=65701 Ack=1 Win=6432 Len=1460"];
  "24.11.146.28"=>"81.131.67.131" [label="(UDP)  17342 -> 41730 Len=8"];
  "81.131.67.131"=>"210.146.64.4" [label="(TCP)  2727 -> 80 [ACK] Seq=1 Ack=67161 Win=8760 Len=0"];
  "24.11.146.28"=>"81.131.67.131" [label="(UDP)  17342 -> 41730 Len=12"];
  "81.131.67.131"=>"24.11.146.28" [label="(UDP)  41730 -> 17342 Len=8"];
  "200.158.81.150"=>"81.131.67.131" [label="(ICMP)  Destination unreachable (Port unreachable)"];
  "149.156.74.157"=>"81.131.67.131" [label="(UDP)  6347 -> 41730 Len=8"];
  "82.232.4.28"=>"81.131.67.131" [label="(TCP)  6346 -> 2814 [ACK] Seq=1 Ack=221 Win=17300 Len=0"];
  "81.131.67.131"=>"70.27.127.185" [label="(TCP)  2094 -> 6346 [ACK] Seq=1 Ack=225 Win=7701 Len=0"];
  "81.131.67.131"=>"142.68.189.57" [label="(TCP)  1595 -> 6346 [ACK] Seq=1 Ack=333 Win=9983 Len=0"];
  "210.146.64.4"=>"81.131.67.131" [label="(TCP)  80 -> 2727 [ACK] Seq=67161 Ack=1 Win=6432 Len=1460"];
  "81.131.67.131"=>"210.146.64.4" [label="(TCP)  2727 -> 80 [ACK] Seq=1 Ack=68621 Win=8760 Len=0"];
  "81.131.67.131"=>"82.232.4.28" [label="(TCP)  2814 -> 6346 [FIN, ACK] Seq=221 Ack=542 Win=8219 Len=0"];
  "62.203.155.212"=>"81.131.67.131" [label="(ICMP)  Destination unreachable (Port unreachable)"];
  "82.232.4.28"=>"81.131.67.131" [label="(TCP)  6346 -> 2814 [FIN, ACK] Seq=542 Ack=221 Win=17300 Len=0"];
  "81.131.67.131"=>"209.89.41.78" [label="(TCP)  2819 -> 41061 [SYN] Seq=0 Win=8760 Len=0 MSS=1460 SACK_PERM=1"];
  "81.131.67.131"=>"82.232.4.28" [label="(TCP)  2814 -> 6346 [ACK] Seq=222 Ack=543 Win=8219 Len=0"];
  "81.131.67.131"=>"84.97.114.126" [label="(UDP)  41730 -> 6347 Len=19"];
  "81.131.67.131"=>"84.156.173.210" [label="(UDP)  41730 -> 6346 Len=19"];
  "81.131.67.131"=>"82.92.79.199" [label="(UDP)  41730 -> 6346 Len=19"];
  "81.131.67.131"=>"68.21.34.173" [label="(UDP)  41730 -> 6346 Len=19"];
  "81.131.67.131"=>"81.241.94.212" [label="(UDP)  41730 -> 6346 Len=19"];
  "210.146.64.4"=>"81.131.67.131" [label="(TCP)  80 -> 2727 [ACK] Seq=68621 Ack=1 Win=6432 Len=1460"];
  "81.131.67.131"=>"82.171.96.179" [label="(UDP)  41730 -> 6346 Len=19"];
  "81.131.67.131"=>"80.185.105.19" [label="(UDP)  41730 -> 6346 Len=19"];
  "65.184.193.172"=>"81.131.67.131" [label="(TCP)  33580 -> 2817 [ACK] Seq=1 Ack=224 Win=64017 Len=0"];
  "62.74.99.96"=>"81.131.67.131" [label="(TCP)  [TCP Retransmission] 2588 -> 1216 [SYN] Seq=0 Win=16384 Len=0 MSS=1460 SACK_PERM=1"];
  "81.131.67.131"=>"172.177.184.179" [label="(UDP)  41730 -> 6346 Len=19"];
  "81.131.67.131"=>"172.186.173.245" [label="(UDP)  41730 -> 6346 Len=19"];
  "81.131.67.131"=>"207.216.13.37" [label="(UDP)  41730 -> 6346 Len=19"];
  "81.131.67.131"=>"85.96.110.115" [label="(UDP)  41730 -> 6346 Len=19"];
  "81.131.67.131"=>"62.74.99.96" [label="(TCP)  1216 -> 2588 [RST, ACK] Seq=1 Ack=1 Win=0 Len=0"];
  "81.131.67.131"=>"82.44.146.72" [label="(UDP)  41730 -> 34087 Len=19"];
  "81.131.67.131"=>"210.146.64.4" [label="(TCP)  2727 -> 80 [ACK] Seq=1 Ack=70081 Win=8760 Len=0"];
  "210.146.64.4"=>"81.131.67.131" [label="(TCP)  80 -> 2727 [ACK] Seq=70081 Ack=1 Win=6432 Len=1460"];
  "81.131.67.131"=>"210.146.64.4" [label="(TCP)  2727 -> 80 [ACK] Seq=1 Ack=71541 Win=8760 Len=0"];
  "211.28.6.30"=>"81.131.67.131" [label="(TCP)  6348 -> 2769 [PSH, ACK] Seq=15361 Ack=1 Win=7809 Len=1024"];
  "2001:638:902:1:201:2ff:fee2:7596"=>"2002:5183:4383::5183:4383" [label="(FTP)  Response: 215 UNIX Type: L8 Version: NetBSD-ftpd 20041119"];
  "2002:5183:4383::5183:4383"=>"2001:638:902:1:201:2ff:fee2:7596" [label="(FTP)  Request: site help"];
  "68.34.169.230"=>"81.131.67.131" [label="(TCP)  6346 -> 2433 [PSH, ACK] Seq=197 Ack=1 Win=64332 Len=61 [TCP segment of a reassembled PDU]"];
  "81.131.67.131"=>"68.34.169.230" [label="(TCP)  2433 -> 6346 [PSH, ACK] Seq=1 Ack=258 Win=7787 Len=23 [TCP segment of a reassembled PDU]"];
  "81.131.67.131"=>"211.28.6.30" [label="(TCP)  2769 -> 6348 [ACK] Seq=1 Ack=16385 Win=7736 Len=0"];
  "81.131.67.131"=>"38.115.4.204" [label="(TCP)  [TCP Retransmission] 2667 -> 21284 [PSH, ACK] Seq=105 Ack=3869 Win=8760 Len=8"];
  "210.146.64.4"=>"81.131.67.131" [label="(TCP)  80 -> 2727 [ACK] Seq=71541 Ack=1 Win=6432 Len=1460"];
  "80.125.99.71"=>"81.131.67.131" [label="(UDP)  6346 -> 41730 Len=8"];
  "81.131.67.131"=>"210.146.64.4" [label="(TCP)  2727 -> 80 [ACK] Seq=1 Ack=73001 Win=8760 Len=0"];
  "81.131.67.131"=>"62.167.89.152" [label="(UDP)  41730 -> 6346 Len=19"];
  "81.131.67.131"=>"83.116.155.57" [label="(UDP)  41730 -> 6346 Len=19"];
  "81.131.67.131"=>"85.135.146.10" [label="(UDP)  41730 -> 6346 Len=19"];
  "81.131.67.131"=>"80.144.139.239" [label="(UDP)  41730 -> 6346 Len=19"];
  "81.131.67.131"=>"81.244.90.24" [label="(UDP)  41730 -> 6346 Len=19"];
  "81.131.67.131"=>"219.137.42.1" [label="(UDP)  41730 -> 6346 Len=19"];
  "81.131.67.131"=>"218.86.72.220" [label="(UDP)  41730 -> 36389 Len=19"];
  "81.131.67.131"=>"68.6.198.57" [label="(UDP)  41730 -> 6347 Len=19"];
  "38.115.4.204"=>"81.131.67.131" [label="(TCP)  [TCP Retransmission] 21284 -> 2667 [PSH, ACK] Seq=2643 Ack=105 Win=65431 Len=1460"];
  "81.131.67.131"=>"38.115.4.204" [label="(TCP)  [TCP ACKed unseen segment] 2667 -> 21284 [ACK] Seq=113 Ack=4103 Win=8526 Len=0"];
  "211.28.6.30"=>"81.131.67.131" [label="(TCP)  6348 -> 2769 [PSH, ACK] Seq=16385 Ack=1 Win=7809 Len=1460"];
  "81.131.67.131"=>"211.28.6.30" [label="(TCP)  2769 -> 6348 [ACK] Seq=1 Ack=17845 Win=8760 Len=0"];
  "213.19.160.190"=>"81.131.67.131" [label="(TCP)  80 -> 2818 [ACK] Seq=1 Ack=283 Win=6432 Len=0"];
  "213.19.160.190"=>"81.131.67.131" [label="(TCP)  HTTP/1.1 206 Partial Content [TCP segment of a reassembled PDU]"];
  "81.131.67.131"=>"213.19.160.190" [label="(TCP)  2818 -> 80 [ACK] Seq=283 Ack=354 Win=8407 Len=0"];
  "81.131.67.131"=>"38.115.4.204" [label="(UDP)  41730 -> 21284 Len=12"];
  "81.131.67.131"=>"139.168.32.121" [label="(UDP)  41730 -> 6346 Len=19"];
  "81.131.67.131"=>"213.54.85.41" [label="(UDP)  41730 -> 6346 Len=19"];
  "81.131.67.131"=>"82.216.238.111" [label="(UDP)  41730 -> 28046 Len=19"];
  "81.131.67.131"=>"38.115.4.204" [label="(UDP)  41730 -> 21284 Len=12"];
  "210.146.64.4"=>"81.131.67.131" [label="(TCP)  80 -> 2727 [PSH, ACK] Seq=73001 Ack=1 Win=6432 Len=1460"];
  "81.131.67.131"=>"210.146.64.4" [label="(TCP)  2727 -> 80 [ACK] Seq=1 Ack=74461 Win=8760 Len=0"];
  "210.146.64.4"=>"81.131.67.131" [label="(TCP)  80 -> 2727 [ACK] Seq=74461 Ack=1 Win=6432 Len=1460"];
  "81.131.67.131"=>"210.146.64.4" [label="(TCP)  2727 -> 80 [ACK] Seq=1 Ack=75921 Win=8760 Len=0"];
  "81.131.67.131"=>"84.56.231.176" [label="(UDP)  41730 -> 6346 Len=19"];
  "81.131.67.131"=>"62.205.109.173" [label="(UDP)  41730 -> 6346 Len=19"];
  "81.131.67.131"=>"80.171.9.79" [label="(UDP)  41730 -> 6346 Len=19"];
  "81.131.67.131"=>"62.131.99.79" [label="(UDP)  41730 -> 6346 Len=19"];
  "81.131.67.131"=>"84.149.148.25" [label="(UDP)  41730 -> 6346 Len=19"];
  "81.131.67.131"=>"81.161.144.10" [label="(UDP)  41730 -> 6346 Len=19"];
  "81.131.67.131"=>"24.43.167.12" [label="(UDP)  41730 -> 6346 Len=19"];
  "81.131.67.131"=>"70.27.127.185" [label="(TCP)  2094 -> 6346 [ACK] Seq=1 Ack=258 Win=7668 Len=0"];
  "213.19.160.190"=>"81.131.67.131" [label="(TCP)  80 -> 2818 [ACK] Seq=354 Ack=283 Win=6432 Len=1460 [TCP segment of a reassembled PDU]"];
  "81.131.67.131"=>"213.19.160.190" [label="(TCP)  2818 -> 80 [ACK] Seq=283 Ack=1814 Win=8760 Len=0"];
  "81.131.67.131"=>"209.89.41.78" [label="(TCP)  [TCP Retransmission] 2819 -> 41061 [SYN] Seq=0 Win=8760 Len=0 MSS=1460 SACK_PERM=1"];
  "210.146.64.4"=>"81.131.67.131" [label="(TCP)  80 -> 2727 [ACK] Seq=75921 Ack=1 Win=6432 Len=1460"];
  "83.53.165.235"=>"81.131.67.131" [label="(TCP)  [TCP Dup ACK 386#1] 6346 -> 2813 [ACK] Seq=1 Ack=1 Win=17424 Len=0"];
  "81.131.67.131"=>"210.146.64.4" [label="(TCP)  2727 -> 80 [ACK] Seq=1 Ack=77381 Win=8760 Len=0"];
  "83.53.165.235"=>"81.131.67.131" [label="(TCP)  [TCP Retransmission] 6346 -> 2813 [SYN, ACK] Seq=0 Ack=1 Win=17424 Len=0 MSS=1452 SACK_PERM=1"];
  "209.89.41.78"=>"81.131.67.131" [label="(TCP)  41061 -> 2819 [SYN, ACK] Seq=0 Ack=1 Win=65535 Len=0 MSS=1460 SACK_PERM=1"];
  "172.201.93.149"=>"81.131.67.131" [label="(MANOLITO)  Ping"];
  "81.131.67.131"=>"81.247.65.177" [label="(UDP)  41730 -> 6346 Len=19"];
  "81.131.67.131"=>"83.117.6.35" [label="(UDP)  41730 -> 6346 Len=19"];
  "84.97.114.126"=>"81.131.67.131" [label="(ICMP)  Destination unreachable (Port unreachable)"];
  "81.131.67.131"=>"195.130.143.128" [label="(UDP)  41730 -> 6346 Len=19"];
  "81.131.67.131"=>"212.194.202.220" [label="(UDP)  41730 -> 6346 Len=19"];
  "81.131.67.131"=>"207.148.176.7" [label="(UDP)  41730 -> 6346 Len=19"];
  "81.131.67.131"=>"83.53.165.235" [label="(TCP)  [TCP Dup ACK 387#1] 2813 -> 6346 [ACK] Seq=223 Ack=1 Win=10164 Len=0"];
  "81.131.67.131"=>"209.89.41.78" [label="(TCP)  2819 -> 41061 [ACK] Seq=1 Ack=1 Win=8760 Len=0"];
  "81.131.67.131"=>"209.89.41.78" [label="(TCP)  2819 -> 41061 [PSH, ACK] Seq=1 Ack=1 Win=8760 Len=221"];
  "81.131.67.131"=>"172.201.93.149" [label="(ICMP)  Destination unreachable (Port unreachable)"];
  "210.146.64.4"=>"81.131.67.131" [label="(TCP)  80 -> 2727 [ACK] Seq=77381 Ack=1 Win=6432 Len=1460"];
  "81.131.67.131"=>"210.146.64.4" [label="(TCP)  2727 -> 80 [ACK] Seq=1 Ack=78841 Win=8760 Len=0"];
  "81.131.67.131"=>"86.130.246.222" [label="(UDP)  6348 -> 6348 Len=29"];
  "81.131.67.131"=>"62.193.101.150" [label="(UDP)  41730 -> 6346 Len=19"];
  "81.131.67.131"=>"212.129.214.254" [label="(UDP)  41730 -> 6346 Len=19"];
  "211.28.6.30"=>"81.131.67.131" [label="(TCP)  6348 -> 2769 [PSH, ACK] Seq=17845 Ack=1 Win=7809 Len=1460"];
  "81.131.67.131"=>"200.158.81.150" [label="(UDP)  41730 -> 6346 Len=19"];
  "81.131.67.131"=>"38.115.4.204" [label="(UDP)  41730 -> 21284 Len=12"];
  "81.131.67.131"=>"211.28.6.30" [label="(TCP)  2769 -> 6348 [ACK] Seq=1 Ack=19305 Win=8760 Len=0"];
  "210.146.64.4"=>"81.131.67.131" [label="(TCP)  80 -> 2727 [PSH, ACK] Seq=78841 Ack=1 Win=6432 Len=1460"];
  "81.131.67.131"=>"210.146.64.4" [label="(TCP)  2727 -> 80 [ACK] Seq=1 Ack=80301 Win=8760 Len=0"];
  "2001:638:902:1:201:2ff:fee2:7596"=>"2002:5183:4383::5183:4383" [label="(FTP)  Response: 214-"];
  "211.28.6.30"=>"81.131.67.131" [label="(TCP)  6348 -> 2769 [PSH, ACK] Seq=19305 Ack=1 Win=7809 Len=152"];
  "172.187.62.41"=>"81.131.67.131" [label="(TCP)  6346 -> 2816 [SYN, ACK] Seq=0 Ack=1 Win=17680 Len=0 MSS=1360 SACK_PERM=1"];
  "81.131.67.131"=>"172.187.62.41" [label="(TCP)  2816 -> 6346 [ACK] Seq=1 Ack=1 Win=9520 Len=0"];
  "81.131.67.131"=>"80.186.123.15" [label="(TCP)  [TCP Retransmission] 2815 -> 6346 [SYN] Seq=0 Win=8760 Len=0 MSS=1460 SACK_PERM=1"];
  "38.115.4.204"=>"81.131.67.131" [label="(TCP)  21284 -> 2667 [PSH, ACK] Seq=4103 Ack=113 Win=65423 Len=592"];
  "81.131.67.131"=>"211.28.6.30" [label="(TCP)  2769 -> 6348 [ACK] Seq=1 Ack=19457 Win=8608 Len=0"];
  "2002:5183:4383::5183:4383"=>"2001:638:902:1:201:2ff:fee2:7596" [label="(TCP)  1026 -> 21 [ACK] Seq=62 Ack=266 Win=16815 Len=0"];
  "68.34.169.230"=>"81.131.67.131" [label="(TCP)  6346 -> 2433 [ACK] Seq=258 Ack=24 Win=64309 Len=0"];
  "172.187.62.41"=>"81.131.67.131" [label="(TCP)  [TCP Dup ACK 515#1] 6346 -> 2816 [ACK] Seq=1 Ack=1 Win=17680 Len=0"];
  "81.131.67.131"=>"38.115.4.204" [label="(TCP)  2667 -> 21284 [ACK] Seq=113 Ack=4695 Win=7934 Len=0"];
  "81.131.67.131"=>"84.84.15.199" [label="(UDP)  41730 -> 15492 Len=476"];
  "210.146.64.4"=>"81.131.67.131" [label="(TCP)  80 -> 2727 [ACK] Seq=80301 Ack=1 Win=6432 Len=1460"];
  "81.131.67.131"=>"210.146.64.4" [label="(TCP)  2727 -> 80 [ACK] Seq=1 Ack=81761 Win=8760 Len=0"];
  "213.19.160.190"=>"81.131.67.131" [label="(TCP)  [TCP Previous segment not captured] 80 -> 2818 [PSH, ACK] Seq=3274 Ack=283 Win=6432 Len=465 [TCP segment of a reassembled PDU]"];
  "81.131.67.131"=>"213.19.160.190" [label="(TCP)  [TCP Dup ACK 484#1] 2818 -> 80 [ACK] Seq=283 Ack=1814 Win=8760 Len=0 SLE=3274 SRE=3739"];
  "81.131.67.131"=>"24.11.146.28" [label="(TCP)  2675 -> 17342 [PSH, ACK] Seq=312 Ack=1 Win=10164 Len=8"];
  "213.19.160.190"=>"81.131.67.131" [label="(TCP)  [TCP Out-Of-Order] 80 -> 2818 [ACK] Seq=1814 Ack=283 Win=6432 Len=1460"];
  "81.131.67.131"=>"213.19.160.190" [label="(TCP)  2818 -> 80 [ACK] Seq=283 Ack=3739 Win=6835 Len=0"];
  "218.86.72.220"=>"81.131.67.131" [label="(UDP)  36389 -> 41730 Len=8"];
  "81.131.67.131"=>"213.19.160.190" [label="(TCP)  [TCP Window Update] 2818 -> 80 [ACK] Seq=283 Ack=3739 Win=8760 Len=0"];
  "81.131.67.131"=>"82.232.4.28" [label="(TCP)  [TCP Retransmission] 2814 -> 6346 [FIN, ACK] Seq=221 Ack=543 Win=8219 Len=0"];
  "81.131.67.131"=>"83.53.165.235" [label="(TCP)  [TCP Retransmission] 2813 -> 6346 [PSH, ACK] Seq=1 Ack=1 Win=10164 Len=222"];
  "211.28.6.30"=>"81.131.67.131" [label="(TCP)  6348 -> 2769 [PSH, ACK] Seq=19457 Ack=1 Win=7809 Len=1460"];
  "81.131.67.131"=>"211.28.6.30" [label="(TCP)  2769 -> 6348 [ACK] Seq=1 Ack=20917 Win=8760 Len=0"];
  "210.146.64.4"=>"81.131.67.131" [label="(TCP)  80 -> 2727 [PSH, ACK] Seq=81761 Ack=1 Win=6432 Len=1460"];
  "81.131.67.131"=>"210.146.64.4" [label="(TCP)  2727 -> 80 [ACK] Seq=1 Ack=83221 Win=8760 Len=0"];
  "81.131.67.131"=>"24.11.146.28" [label="(UDP)  41730 -> 17342 Len=12"];
  "81.131.67.131"=>"69.4.150.232" [label="(UDP)  41730 -> 6346 Len=19"];
  "81.131.67.131"=>"65.43.223.20" [label="(UDP)  41730 -> 6346 Len=19"];
  "81.131.67.131"=>"151.37.67.40" [label="(UDP)  41730 -> 6346 Len=19"];
  "81.131.67.131"=>"82.92.21.6" [label="(UDP)  41730 -> 6346 Len=19"];
  "81.131.67.131"=>"139.55.21.35" [label="(UDP)  41730 -> 63346 Len=386"];
  "211.28.6.30"=>"81.131.67.131" [label="(TCP)  6348 -> 2769 [PSH, ACK] Seq=20917 Ack=1 Win=7809 Len=588"];
  "81.131.67.131"=>"211.28.6.30" [label="(TCP)  2769 -> 6348 [ACK] Seq=1 Ack=21505 Win=8172 Len=0"];
  "210.146.64.4"=>"81.131.67.131" [label="(TCP)  80 -> 2727 [ACK] Seq=83221 Ack=1 Win=6432 Len=1460"];
  "81.131.67.131"=>"210.146.64.4" [label="(TCP)  2727 -> 80 [ACK] Seq=1 Ack=84681 Win=8760 Len=0"];
  "142.68.189.57"=>"81.131.67.131" [label="(TCP)  [TCP segment of a reassembled PDU]"];
  "83.53.165.235"=>"81.131.67.131" [label="(TCP)  6346 -> 2813 [FIN, ACK] Seq=536 Ack=223 Win=17202 Len=0"];
  "81.131.67.131"=>"83.53.165.235" [label="(TCP)  2813 -> 6346 [ACK] Seq=223 Ack=537 Win=9629 Len=0"];
  "81.131.67.131"=>"83.53.165.235" [label="(TCP)  2813 -> 6346 [FIN, ACK] Seq=223 Ack=537 Win=9629 Len=0"];
  "81.131.67.131"=>"69.224.47.236" [label="(TCP)  2821 -> 14280 [SYN] Seq=0 Win=8760 Len=0 MSS=1460 SACK_PERM=1"];
  "81.131.67.131"=>"70.27.127.185" [label="(TCP)  2094 -> 6346 [ACK] Seq=1 Ack=293 Win=7633 Len=0"];
  "210.146.64.4"=>"81.131.67.131" [label="(TCP)  80 -> 2727 [ACK] Seq=84681 Ack=1 Win=6432 Len=1460"];
  "81.131.67.131"=>"210.146.64.4" [label="(TCP)  2727 -> 80 [ACK] Seq=1 Ack=86141 Win=8760 Len=0"];
  "209.89.41.78"=>"81.131.67.131" [label="(TCP)  [TCP Retransmission] 41061 -> 2819 [SYN, ACK] Seq=0 Ack=1 Win=65535 Len=0 MSS=1460 SACK_PERM=1"];
  "81.131.67.131"=>"209.89.41.78" [label="(TCP)  [TCP Dup ACK 499#1] 2819 -> 41061 [ACK] Seq=222 Ack=1 Win=8760 Len=0"];
  "209.89.41.78"=>"81.131.67.131" [label="(TCP)  [TCP Dup ACK 490#1] 41061 -> 2819 [ACK] Seq=1 Ack=1 Win=65535 Len=0"];
  "86.130.246.222"=>"81.131.67.131" [label="(UDP)  6348 -> 6348 Len=84"];
  "81.131.67.131"=>"84.97.114.126" [label="(UDP)  41730 -> 6347 Len=19"];
}